"No.","Time","Source","Destination","Protocol","Length","Info"
"1","0.000000","2001:b07:ae5:604b:605a:732d:3322:5c15","2a00:1450:4013:c05::bc","TCP","75","23212  >  5228 [ACK] Seq=1 Ack=1 Win=512 Len=1"
"2","0.033519","2a00:1450:4013:c05::bc","2001:b07:ae5:604b:605a:732d:3322:5c15","TCP","86","5228  >  23212 [ACK] Seq=1 Ack=2 Win=265 Len=0 SLE=1 SRE=2"
"3","0.215760","2001:b07:ae5:604b:605a:732d:3322:5c15","2a00:1450:4002:405::2002","TCP","75","23264  >  443 [ACK] Seq=1 Ack=1 Win=509 Len=1 [TCP segment of a reassembled PDU]"
"4","0.230848","2a00:1450:4002:405::2002","2001:b07:ae5:604b:605a:732d:3322:5c15","TCP","86","443  >  23264 [ACK] Seq=1 Ack=2 Win=262 Len=0 SLE=1 SRE=2"
"5","0.288037","192.168.1.254","239.255.255.250","SSDP","403","NOTIFY * HTTP/1.1 "
"6","0.288037","192.168.1.254","239.255.255.250","SSDP","475","NOTIFY * HTTP/1.1 "
"7","0.288037","192.168.1.254","239.255.255.250","SSDP","412","NOTIFY * HTTP/1.1 "
"8","0.288037","192.168.1.254","239.255.255.250","SSDP","471","NOTIFY * HTTP/1.1 "
"9","0.288037","192.168.1.254","239.255.255.250","SSDP","412","NOTIFY * HTTP/1.1 "
"10","0.288037","192.168.1.254","239.255.255.250","SSDP","451","NOTIFY * HTTP/1.1 "
"11","0.288037","192.168.1.254","239.255.255.250","SSDP","412","NOTIFY * HTTP/1.1 "
"12","0.288037","192.168.1.254","239.255.255.250","SSDP","483","NOTIFY * HTTP/1.1 "
"13","0.288037","192.168.1.254","239.255.255.250","SSDP","465","NOTIFY * HTTP/1.1 "
"14","0.288037","192.168.1.254","239.255.255.250","SSDP","467","NOTIFY * HTTP/1.1 "
"15","0.377393","2001:b07:ae5:604b:605a:732d:3322:5c15","2a00:1450:4013:c00::66","TCP","75","23230  >  443 [ACK] Seq=1 Ack=1 Win=513 Len=1 [TCP segment of a reassembled PDU]"
"16","0.412613","2a00:1450:4013:c00::66","2001:b07:ae5:604b:605a:732d:3322:5c15","TCP","86","443  >  23230 [ACK] Seq=1 Ack=2 Win=268 Len=0 SLE=1 SRE=2"
"17","0.602847","192.168.1.64","18.195.202.253","TCP","1514","19886  >  443 [ACK] Seq=1 Ack=1 Win=508 Len=1460 [TCP segment of a reassembled PDU]"
"18","0.602847","192.168.1.64","18.195.202.253","TCP","1514","19886  >  443 [ACK] Seq=1461 Ack=1 Win=508 Len=1460 [TCP segment of a reassembled PDU]"
"19","0.602847","192.168.1.64","18.195.202.253","TCP","1514","19886  >  443 [ACK] Seq=2921 Ack=1 Win=508 Len=1460 [TCP segment of a reassembled PDU]"
"20","0.602847","192.168.1.64","18.195.202.253","TCP","1514","19886  >  443 [ACK] Seq=4381 Ack=1 Win=508 Len=1460 [TCP segment of a reassembled PDU]"
"21","0.602847","192.168.1.64","18.195.202.253","TCP","1514","19886  >  443 [ACK] Seq=5841 Ack=1 Win=508 Len=1460 [TCP segment of a reassembled PDU]"
"22","0.602847","192.168.1.64","18.195.202.253","TCP","1514","19886  >  443 [ACK] Seq=7301 Ack=1 Win=508 Len=1460 [TCP segment of a reassembled PDU]"
"23","0.602847","192.168.1.64","18.195.202.253","TCP","1514","19886  >  443 [ACK] Seq=8761 Ack=1 Win=508 Len=1460 [TCP segment of a reassembled PDU]"
"24","0.602847","192.168.1.64","18.195.202.253","TCP","1514","19886  >  443 [ACK] Seq=10221 Ack=1 Win=508 Len=1460 [TCP segment of a reassembled PDU]"
"25","0.602847","192.168.1.64","18.195.202.253","TCP","1514","19886  >  443 [ACK] Seq=11681 Ack=1 Win=508 Len=1460 [TCP segment of a reassembled PDU]"
"26","0.602847","192.168.1.64","18.195.202.253","TCP","1514","19886  >  443 [ACK] Seq=13141 Ack=1 Win=508 Len=1460 [TCP segment of a reassembled PDU]"
"27","0.602847","192.168.1.64","18.195.202.253","TCP","1514","19886  >  443 [ACK] Seq=14601 Ack=1 Win=508 Len=1460 [TCP segment of a reassembled PDU]"
"28","0.602847","192.168.1.64","18.195.202.253","TLSv1.2","407","Application Data"
"29","0.603003","192.168.1.64","18.195.202.253","TCP","1514","19886  >  443 [ACK] Seq=16414 Ack=1 Win=508 Len=1460 [TCP segment of a reassembled PDU]"
"30","0.603003","192.168.1.64","18.195.202.253","TCP","1514","19886  >  443 [ACK] Seq=17874 Ack=1 Win=508 Len=1460 [TCP segment of a reassembled PDU]"
"31","0.603003","192.168.1.64","18.195.202.253","TCP","1514","19886  >  443 [ACK] Seq=19334 Ack=1 Win=508 Len=1460 [TCP segment of a reassembled PDU]"
"32","0.603003","192.168.1.64","18.195.202.253","TCP","1514","19886  >  443 [ACK] Seq=20794 Ack=1 Win=508 Len=1460 [TCP segment of a reassembled PDU]"
"33","0.603003","192.168.1.64","18.195.202.253","TCP","1514","19886  >  443 [ACK] Seq=22254 Ack=1 Win=508 Len=1460 [TCP segment of a reassembled PDU]"
"34","0.603003","192.168.1.64","18.195.202.253","TCP","1514","19886  >  443 [ACK] Seq=23714 Ack=1 Win=508 Len=1460 [TCP segment of a reassembled PDU]"
"35","0.603003","192.168.1.64","18.195.202.253","TCP","1514","19886  >  443 [ACK] Seq=25174 Ack=1 Win=508 Len=1460 [TCP segment of a reassembled PDU]"
"36","0.603003","192.168.1.64","18.195.202.253","TCP","1514","19886  >  443 [ACK] Seq=26634 Ack=1 Win=508 Len=1460 [TCP segment of a reassembled PDU]"
"37","0.603003","192.168.1.64","18.195.202.253","TCP","1514","19886  >  443 [ACK] Seq=28094 Ack=1 Win=508 Len=1460 [TCP segment of a reassembled PDU]"
"38","0.603003","192.168.1.64","18.195.202.253","TCP","1514","19886  >  443 [ACK] Seq=29554 Ack=1 Win=508 Len=1460 [TCP segment of a reassembled PDU]"
"39","0.603003","192.168.1.64","18.195.202.253","TCP","1514","19886  >  443 [ACK] Seq=31014 Ack=1 Win=508 Len=1460 [TCP segment of a reassembled PDU]"
"40","0.603003","192.168.1.64","18.195.202.253","TLSv1.2","407","Application Data"
"41","0.603125","192.168.1.64","18.195.202.253","TCP","1514","19886  >  443 [ACK] Seq=32827 Ack=1 Win=508 Len=1460 [TCP segment of a reassembled PDU]"
"42","0.603125","192.168.1.64","18.195.202.253","TCP","1514","19886  >  443 [ACK] Seq=34287 Ack=1 Win=508 Len=1460 [TCP segment of a reassembled PDU]"
"43","0.603125","192.168.1.64","18.195.202.253","TCP","1514","19886  >  443 [ACK] Seq=35747 Ack=1 Win=508 Len=1460 [TCP segment of a reassembled PDU]"
"44","0.603125","192.168.1.64","18.195.202.253","TCP","1514","19886  >  443 [ACK] Seq=37207 Ack=1 Win=508 Len=1460 [TCP segment of a reassembled PDU]"
"45","0.603125","192.168.1.64","18.195.202.253","TCP","1514","19886  >  443 [ACK] Seq=38667 Ack=1 Win=508 Len=1460 [TCP segment of a reassembled PDU]"
"46","0.603125","192.168.1.64","18.195.202.253","TLSv1.2","866","Application Data"
"47","0.631182","18.195.202.253","192.168.1.64","TCP","60","443  >  19886 [ACK] Seq=1 Ack=2921 Win=4548 Len=0"
"48","0.633183","18.195.202.253","192.168.1.64","TCP","60","443  >  19886 [ACK] Seq=1 Ack=5841 Win=4548 Len=0"
"49","0.633183","18.195.202.253","192.168.1.64","TCP","60","443  >  19886 [ACK] Seq=1 Ack=8761 Win=4548 Len=0"
"50","0.634315","18.195.202.253","192.168.1.64","TCP","60","443  >  19886 [ACK] Seq=1 Ack=11681 Win=4548 Len=0"
"51","0.635140","18.195.202.253","192.168.1.64","TCP","60","443  >  19886 [ACK] Seq=1 Ack=14601 Win=4548 Len=0"
"52","0.635668","18.195.202.253","192.168.1.64","TCP","60","443  >  19886 [ACK] Seq=1 Ack=16414 Win=4548 Len=0"
"53","0.638022","18.195.202.253","192.168.1.64","TCP","60","443  >  19886 [ACK] Seq=1 Ack=19334 Win=4548 Len=0"
"54","0.638129","18.195.202.253","192.168.1.64","TCP","60","443  >  19886 [ACK] Seq=1 Ack=22254 Win=4548 Len=0"
"55","0.639406","18.195.202.253","192.168.1.64","TCP","60","443  >  19886 [ACK] Seq=1 Ack=25174 Win=4548 Len=0"
"56","0.640668","18.195.202.253","192.168.1.64","TCP","60","443  >  19886 [ACK] Seq=1 Ack=28094 Win=4548 Len=0"
"57","0.641414","18.195.202.253","192.168.1.64","TCP","60","443  >  19886 [ACK] Seq=1 Ack=31014 Win=4548 Len=0"
"58","0.642353","18.195.202.253","192.168.1.64","TCP","60","443  >  19886 [ACK] Seq=1 Ack=32827 Win=4548 Len=0"
"59","0.644348","18.195.202.253","192.168.1.64","TCP","60","443  >  19886 [ACK] Seq=1 Ack=35747 Win=4548 Len=0"
"60","0.645074","18.195.202.253","192.168.1.64","TCP","60","443  >  19886 [ACK] Seq=1 Ack=38667 Win=4548 Len=0"
"61","0.645074","18.195.202.253","192.168.1.64","TCP","60","443  >  19886 [ACK] Seq=1 Ack=40939 Win=4548 Len=0"
"62","0.646966","18.195.202.253","192.168.1.64","TLSv1.2","182","Application Data"
"63","0.697140","192.168.1.64","18.195.202.253","TCP","54","19886  >  443 [ACK] Seq=40939 Ack=129 Win=508 Len=0"
"64","1.388303","2001:b07:ae5:604b:605a:732d:3322:5c15","2a00:1450:4002:402::200e","TLSv1.2","703","Application Data"
"65","1.388524","2001:b07:ae5:604b:605a:732d:3322:5c15","2a00:1450:4002:402::200e","TLSv1.2","3238","Application Data"
"66","1.406946","2a00:1450:4002:402::200e","2001:b07:ae5:604b:605a:732d:3322:5c15","TCP","74","443  >  23248 [ACK] Seq=1 Ack=630 Win=1819 Len=0"
"67","1.407071","2a00:1450:4002:402::200e","2001:b07:ae5:604b:605a:732d:3322:5c15","TCP","74","443  >  23248 [ACK] Seq=1 Ack=1850 Win=1828 Len=0"
"68","1.408325","2a00:1450:4002:402::200e","2001:b07:ae5:604b:605a:732d:3322:5c15","TCP","74","443  >  23248 [ACK] Seq=1 Ack=3070 Win=1838 Len=0"
"69","1.408325","2a00:1450:4002:402::200e","2001:b07:ae5:604b:605a:732d:3322:5c15","TCP","74","443  >  23248 [ACK] Seq=1 Ack=3794 Win=1847 Len=0"
"70","1.425037","2001:b07:ae5:604b:605a:732d:3322:5c15","2a00:1450:4002:405::200a","TCP","75","23235  >  443 [ACK] Seq=1 Ack=1 Win=509 Len=1 [TCP segment of a reassembled PDU]"
"71","1.433783","2a00:1450:4002:402::200e","2001:b07:ae5:604b:605a:732d:3322:5c15","TLSv1.2","334","Application Data"
"72","1.433783","2a00:1450:4002:402::200e","2001:b07:ae5:604b:605a:732d:3322:5c15","TLSv1.2","136","Application Data"
"73","1.433783","2a00:1450:4002:402::200e","2001:b07:ae5:604b:605a:732d:3322:5c15","TLSv1.2","105","Application Data"
"74","1.433783","2a00:1450:4002:402::200e","2001:b07:ae5:604b:605a:732d:3322:5c15","TLSv1.2","113","Application Data"
"75","1.433904","2001:b07:ae5:604b:605a:732d:3322:5c15","2a00:1450:4002:402::200e","TCP","74","23248  >  443 [ACK] Seq=3794 Ack=393 Win=2054 Len=0"
"76","1.435656","2001:b07:ae5:604b:605a:732d:3322:5c15","2a00:1450:4002:402::200e","TLSv1.2","109","Application Data"
"77","1.435794","2001:b07:ae5:604b:605a:732d:3322:5c15","2a00:1450:4002:402::200e","TLSv1.2","113","Application Data"
"78","1.443911","2a00:1450:4002:405::200a","2001:b07:ae5:604b:605a:732d:3322:5c15","TCP","86","443  >  23235 [ACK] Seq=1 Ack=2 Win=262 Len=0 SLE=1 SRE=2"
"79","1.454305","2a00:1450:4002:402::200e","2001:b07:ae5:604b:605a:732d:3322:5c15","TCP","74","443  >  23248 [ACK] Seq=393 Ack=3868 Win=1847 Len=0"
"80","1.656189","192.168.1.64","142.250.184.106","TCP","55","23236  >  443 [ACK] Seq=1 Ack=1 Win=509 Len=1 [TCP segment of a reassembled PDU]"
"81","1.674034","142.250.184.106","192.168.1.64","TCP","66","443  >  23236 [ACK] Seq=1 Ack=2 Win=261 Len=0 SLE=1 SRE=2"
"82","1.825055","192.0.78.23","192.168.1.64","TLSv1.2","78","Application Data"
"83","1.825503","192.168.1.64","192.0.78.23","TLSv1.2","82","Application Data"
"84","1.843860","192.0.78.23","192.168.1.64","TCP","60","443  >  23130 [ACK] Seq=25 Ack=29 Win=65 Len=0"
"85","3.354005","2001:b07:ae5:604b:605a:732d:3322:5c15","2a00:1450:4002:402::2006","TCP","75","23265  >  443 [ACK] Seq=1 Ack=1 Win=511 Len=1 [TCP segment of a reassembled PDU]"
"86","3.403689","2a00:1450:4002:402::2006","2001:b07:ae5:604b:605a:732d:3322:5c15","TCP","86","443  >  23265 [ACK] Seq=1 Ack=2 Win=261 Len=0 SLE=1 SRE=2"
"87","5.023582","2001:b07:ae5:604b:605a:732d:3322:5c15","2a00:1450:4002:402::200e","TLSv1.2","2633","Application Data"
"88","5.043143","2a00:1450:4002:402::200e","2001:b07:ae5:604b:605a:732d:3322:5c15","TCP","74","443  >  23248 [ACK] Seq=393 Ack=6308 Win=1866 Len=0"
"89","5.048228","2a00:1450:4002:402::200e","2001:b07:ae5:604b:605a:732d:3322:5c15","TCP","74","443  >  23248 [ACK] Seq=393 Ack=6427 Win=1866 Len=0"
"90","5.048654","192.168.1.64","142.251.209.34","QUIC","1292","Initial, DCID=6e20d06ead03931a, PKN: 1, PADDING, PING, PING, PING, PING, PING, PADDING, PING, PADDING, CRYPTO"
"91","5.049035","192.168.1.64","142.251.209.34","QUIC","116","0-RTT, DCID=6e20d06ead03931a"
"92","5.049320","192.168.1.64","142.251.209.34","QUIC","1288","0-RTT, DCID=6e20d06ead03931a"
"93","5.049365","192.168.1.64","142.251.209.34","QUIC","371","0-RTT, DCID=6e20d06ead03931a"
"94","5.073258","2a00:1450:4002:402::200e","2001:b07:ae5:604b:605a:732d:3322:5c15","TLSv1.2","333","Application Data"
"95","5.073258","2a00:1450:4002:402::200e","2001:b07:ae5:604b:605a:732d:3322:5c15","TLSv1.2","147","Application Data"
"96","5.073433","2001:b07:ae5:604b:605a:732d:3322:5c15","2a00:1450:4002:402::200e","TCP","74","23248  >  443 [ACK] Seq=6427 Ack=725 Win=2058 Len=0"
"97","5.074680","2a00:1450:4002:402::200e","2001:b07:ae5:604b:605a:732d:3322:5c15","TLSv1.2","105","Application Data"
"98","5.074680","2a00:1450:4002:402::200e","2001:b07:ae5:604b:605a:732d:3322:5c15","TLSv1.2","113","Application Data"
"99","5.074789","2001:b07:ae5:604b:605a:732d:3322:5c15","2a00:1450:4002:402::200e","TCP","74","23248  >  443 [ACK] Seq=6427 Ack=795 Win=2058 Len=0"
"100","5.075831","2001:b07:ae5:604b:605a:732d:3322:5c15","2a00:1450:4002:402::200e","TLSv1.2","113","Application Data"
"101","5.082862","142.251.209.34","192.168.1.64","QUIC","1292","Protected Payload (KP0)"
"102","5.082862","142.251.209.34","192.168.1.64","QUIC","832","Protected Payload (KP0)"
"103","5.085809","142.251.209.34","192.168.1.64","QUIC","134","Protected Payload (KP0)"
"104","5.085809","142.251.209.34","192.168.1.64","QUIC","67","Protected Payload (KP0)"
"105","5.085828","192.168.1.64","142.251.209.34","QUIC","1292","Handshake, DCID=6e20d06ead03931a"
"106","5.086556","192.168.1.64","142.251.209.34","QUIC","115","Handshake, DCID=6e20d06ead03931a"
"107","5.087116","192.168.1.64","142.251.209.34","QUIC","75","Protected Payload (KP0), DCID=6e20d06ead03931a"
"108","5.098892","2a00:1450:4002:402::200e","2001:b07:ae5:604b:605a:732d:3322:5c15","TCP","74","443  >  23248 [ACK] Seq=795 Ack=6466 Win=1866 Len=0"
"109","5.109812","142.251.209.34","192.168.1.64","QUIC","67","Protected Payload (KP0)"
"110","5.109812","142.251.209.34","192.168.1.64","QUIC","162","Protected Payload (KP0)"
"111","5.110062","192.168.1.64","142.251.209.34","QUIC","75","Protected Payload (KP0), DCID=6e20d06ead03931a"
"112","5.132881","142.251.209.34","192.168.1.64","QUIC","488","Protected Payload (KP0)"
"113","5.133089","192.168.1.64","142.251.209.34","QUIC","77","Protected Payload (KP0), DCID=6e20d06ead03931a"
"114","5.133256","142.251.209.34","192.168.1.64","QUIC","67","Protected Payload (KP0)"
"115","5.151650","142.251.209.34","192.168.1.64","QUIC","67","Protected Payload (KP0)"
"116","5.159688","192.168.1.64","142.251.209.34","QUIC","75","Protected Payload (KP0), DCID=6e20d06ead03931a"
"117","5.241136","2001:b07:ae5:604b:605a:732d:3322:5c15","2a00:1450:4002:402::200e","TLSv1.2","1755","Application Data"
"118","5.241967","2001:b07:ae5:604b:605a:732d:3322:5c15","2a00:1450:4002:402::200e","TLSv1.2","977","Application Data"
"119","5.242026","2001:b07:ae5:604b:605a:732d:3322:5c15","2a00:1450:4002:402::200e","TLSv1.2","331","Application Data"
"120","5.248775","2001:b07:ae5:604b:605a:732d:3322:5c15","2a00:1450:4002:402::200e","TLSv1.2","2084","Application Data"
"121","5.260675","2a00:1450:4002:402::200e","2001:b07:ae5:604b:605a:732d:3322:5c15","TCP","74","443  >  23248 [ACK] Seq=795 Ack=7686 Win=1876 Len=0"
"122","5.260675","2a00:1450:4002:402::200e","2001:b07:ae5:604b:605a:732d:3322:5c15","TCP","74","443  >  23248 [ACK] Seq=795 Ack=8147 Win=1885 Len=0"
"123","5.268225","2a00:1450:4002:402::200e","2001:b07:ae5:604b:605a:732d:3322:5c15","TCP","74","443  >  23248 [ACK] Seq=795 Ack=9050 Win=1895 Len=0"
"124","5.268225","2a00:1450:4002:402::200e","2001:b07:ae5:604b:605a:732d:3322:5c15","TCP","74","443  >  23248 [ACK] Seq=795 Ack=9307 Win=1905 Len=0"
"125","5.272594","2001:b07:ae5:604b:605a:732d:3322:5c15","2a00:1450:4002:402::200e","TLSv1.2","857","Application Data"
"126","5.272767","2001:b07:ae5:604b:605a:732d:3322:5c15","2a00:1450:4002:402::200e","TLSv1.2","331","Application Data"
"127","5.273582","2001:b07:ae5:604b:605a:732d:3322:5c15","2a00:1450:4002:402::200e","TLSv1.2","791","Application Data"
"128","5.277304","2a00:1450:4002:402::200e","2001:b07:ae5:604b:605a:732d:3322:5c15","TCP","74","443  >  23248 [ACK] Seq=795 Ack=10527 Win=1914 Len=0"
"129","5.277304","2a00:1450:4002:402::200e","2001:b07:ae5:604b:605a:732d:3322:5c15","TCP","74","443  >  23248 [ACK] Seq=795 Ack=11317 Win=1924 Len=0"
"130","5.281035","2a00:1450:4002:402::200e","2001:b07:ae5:604b:605a:732d:3322:5c15","TLSv1.2","145","Application Data"
"131","5.282350","2a00:1450:4002:402::200e","2001:b07:ae5:604b:605a:732d:3322:5c15","TLSv1.2","105","Application Data"
"132","5.282383","2001:b07:ae5:604b:605a:732d:3322:5c15","2a00:1450:4002:402::200e","TCP","74","23248  >  443 [ACK] Seq=13074 Ack=897 Win=2058 Len=0"
"133","5.283145","2a00:1450:4002:402::200e","2001:b07:ae5:604b:605a:732d:3322:5c15","TLSv1.2","113","Application Data"
"134","5.283145","2a00:1450:4002:402::200e","2001:b07:ae5:604b:605a:732d:3322:5c15","TLSv1.2","147","Application Data"
"135","5.283169","2001:b07:ae5:604b:605a:732d:3322:5c15","2a00:1450:4002:402::200e","TCP","74","23248  >  443 [ACK] Seq=13074 Ack=1009 Win=2057 Len=0"
"136","5.283574","2001:b07:ae5:604b:605a:732d:3322:5c15","2a00:1450:4002:402::200e","TLSv1.2","113","Application Data"
"137","5.287526","2001:b07:ae5:604b:605a:732d:3322:5c15","2a00:1450:4002:402::200e","TLSv1.2","1131","Application Data"
"138","5.293959","2a00:1450:4002:402::200e","2001:b07:ae5:604b:605a:732d:3322:5c15","TCP","74","443  >  23248 [ACK] Seq=1009 Ack=12357 Win=1943 Len=0"
"139","5.296005","192.168.1.64","142.250.184.98","QUIC","1292","Initial, DCID=ceb04ff2bca3bdef, PKN: 1, PING, CRYPTO, CRYPTO, PADDING, PING, CRYPTO, CRYPTO, PADDING"
"140","5.297824","2a00:1450:4002:402::200e","2001:b07:ae5:604b:605a:732d:3322:5c15","TCP","74","443  >  23248 [ACK] Seq=1009 Ack=13074 Win=1952 Len=0"
"141","5.297953","192.168.1.64","142.250.184.98","QUIC","119","0-RTT, DCID=ceb04ff2bca3bdef"
"142","5.298842","192.168.1.64","142.250.184.98","QUIC","1288","0-RTT, DCID=ceb04ff2bca3bdef"
"143","5.298890","192.168.1.64","142.250.184.98","QUIC","802","0-RTT, DCID=ceb04ff2bca3bdef"
"144","5.299173","192.168.1.64","142.251.209.34","QUIC","177","Protected Payload (KP0), DCID=6e20d06ead03931a"
"145","5.299324","192.168.1.64","142.251.209.34","QUIC","1123","Protected Payload (KP0), DCID=6e20d06ead03931a"
"146","5.299330","2001:b07:ae5:604b:605a:732d:3322:5c15","2001:b07:ae5:604b::1","DNS","92","Standard query 0x3737 A i1.ytimg.com"
"147","5.299414","2a00:1450:4002:402::200e","2001:b07:ae5:604b:605a:732d:3322:5c15","TLSv1.2","309","Application Data"
"148","5.299414","2a00:1450:4002:402::200e","2001:b07:ae5:604b:605a:732d:3322:5c15","TLSv1.2","147","Application Data"
"149","5.299414","2a00:1450:4002:402::200e","2001:b07:ae5:604b:605a:732d:3322:5c15","TLSv1.2","105","Application Data"
"150","5.299458","2001:b07:ae5:604b:605a:732d:3322:5c15","2a00:1450:4002:406::2001","TLSv1.2","194","Application Data"
"151","5.299461","2001:b07:ae5:604b:605a:732d:3322:5c15","2a00:1450:4002:402::200e","TCP","74","23248  >  443 [ACK] Seq=14170 Ack=1348 Win=2056 Len=0"
"152","5.299471","2001:b07:ae5:604b:605a:732d:3322:5c15","2001:b07:ae5:604b::1","DNS","92","Standard query 0x9547 AAAA i1.ytimg.com"
"153","5.299496","2001:b07:ae5:604b:605a:732d:3322:5c15","2a00:1450:4002:406::2001","TLSv1.2","113","Application Data"
"154","5.305657","2a00:1450:4002:402::200e","2001:b07:ae5:604b:605a:732d:3322:5c15","TCP","74","443  >  23248 [ACK] Seq=1348 Ack=14170 Win=1962 Len=0"
"155","5.312203","2001:b07:ae5:604b::1","2001:b07:ae5:604b:605a:732d:3322:5c15","DNS","108","Standard query response 0x3737 A i1.ytimg.com A 142.250.184.78"
"156","5.312203","2001:b07:ae5:604b::1","2001:b07:ae5:604b:605a:732d:3322:5c15","DNS","120","Standard query response 0x9547 AAAA i1.ytimg.com AAAA 2a00:1450:4002:405::200e"
"157","5.312682","2001:b07:ae5:604b:605a:732d:3322:5c15","2a00:1450:4002:405::200e","TCP","86","23317  >  443 [SYN] Seq=0 Win=65320 Len=0 MSS=1420 WS=256 SACK_PERM"
"158","5.313856","2a00:1450:4002:402::200e","2001:b07:ae5:604b:605a:732d:3322:5c15","TLSv1.2","147","Application Data"
"159","5.313897","2001:b07:ae5:604b:605a:732d:3322:5c15","2a00:1450:4002:402::200e","TCP","74","23248  >  443 [ACK] Seq=14170 Ack=1421 Win=2056 Len=0"
"160","5.314720","2a00:1450:4002:402::200e","2001:b07:ae5:604b:605a:732d:3322:5c15","TLSv1.2","105","Application Data"
"161","5.314720","2a00:1450:4002:402::200e","2001:b07:ae5:604b:605a:732d:3322:5c15","TLSv1.2","113","Application Data"
"162","5.314789","2001:b07:ae5:604b:605a:732d:3322:5c15","2a00:1450:4002:402::200e","TCP","74","23248  >  443 [ACK] Seq=14170 Ack=1491 Win=2055 Len=0"
"163","5.315776","2001:b07:ae5:604b:605a:732d:3322:5c15","2a00:1450:4002:402::200e","TLSv1.2","113","Application Data"
"164","5.316319","2a00:1450:4002:402::200e","2001:b07:ae5:604b:605a:732d:3322:5c15","TLSv1.2","145","Application Data"
"165","5.316319","2a00:1450:4002:402::200e","2001:b07:ae5:604b:605a:732d:3322:5c15","TLSv1.2","105","Application Data"
"166","5.316367","2001:b07:ae5:604b:605a:732d:3322:5c15","2a00:1450:4002:402::200e","TCP","74","23248  >  443 [ACK] Seq=14209 Ack=1593 Win=2055 Len=0"
"167","5.319998","2a00:1450:4002:406::2001","2001:b07:ae5:604b:605a:732d:3322:5c15","TCP","74","443  >  23263 [ACK] Seq=1 Ack=121 Win=280 Len=0"
"168","5.319998","142.251.209.34","192.168.1.64","QUIC","69","Protected Payload (KP0)"
"169","5.320686","142.251.209.34","192.168.1.64","QUIC","67","Protected Payload (KP0)"
"170","5.320686","142.251.209.34","192.168.1.64","QUIC","67","Protected Payload (KP0)"
"171","5.320805","192.168.1.64","142.251.209.34","QUIC","75","Protected Payload (KP0), DCID=6e20d06ead03931a"
"172","5.321913","2a00:1450:4002:406::2001","2001:b07:ae5:604b:605a:732d:3322:5c15","TCP","74","443  >  23263 [ACK] Seq=1 Ack=160 Win=280 Len=0"
"173","5.321946","2a00:1450:4002:406::2001","2001:b07:ae5:604b:605a:732d:3322:5c15","TLSv1.2","1291","[TCP Previous segment not captured] , Application Data, Application Data"
"174","5.321961","2001:b07:ae5:604b:605a:732d:3322:5c15","2a00:1450:4002:406::2001","TCP","86","[TCP Dup ACK 150#1] 23263  >  443 [ACK] Seq=160 Ack=1 Win=513 Len=0 SLE=5023 SRE=6240"
"175","5.324780","2a00:1450:4002:406::2001","2001:b07:ae5:604b:605a:732d:3322:5c15","TCP","113","[TCP Out-Of-Order] 443  >  23263 [PSH, ACK] Seq=1 Ack=160 Win=280 Len=39"
"176","5.324780","2a00:1450:4002:406::2001","2001:b07:ae5:604b:605a:732d:3322:5c15","TCP","177","[TCP Out-Of-Order] 443  >  23263 [PSH, ACK] Seq=40 Ack=160 Win=280 Len=103"
"177","5.324780","2a00:1450:4002:406::2001","2001:b07:ae5:604b:605a:732d:3322:5c15","TCP","1294","[TCP Out-Of-Order] 443  >  23263 [PSH, ACK] Seq=143 Ack=160 Win=280 Len=1220"
"178","5.324828","2001:b07:ae5:604b:605a:732d:3322:5c15","2a00:1450:4002:406::2001","TCP","86","23263  >  443 [ACK] Seq=160 Ack=40 Win=512 Len=0 SLE=5023 SRE=6240"
"179","5.324873","2001:b07:ae5:604b:605a:732d:3322:5c15","2a00:1450:4002:406::2001","TCP","86","23263  >  443 [ACK] Seq=160 Ack=143 Win=512 Len=0 SLE=5023 SRE=6240"
"180","5.324885","2001:b07:ae5:604b:605a:732d:3322:5c15","2a00:1450:4002:406::2001","TCP","86","23263  >  443 [ACK] Seq=160 Ack=1363 Win=514 Len=0 SLE=5023 SRE=6240"
"181","5.325352","2001:b07:ae5:604b:605a:732d:3322:5c15","2a00:1450:4002:406::2001","TLSv1.2","109","Application Data"
"182","5.329246","2a00:1450:4002:406::2001","2001:b07:ae5:604b:605a:732d:3322:5c15","TCP","1294","[TCP Retransmission] 443  >  23263 [PSH, ACK] Seq=1363 Ack=160 Win=280 Len=1220"
"183","5.329246","2a00:1450:4002:406::2001","2001:b07:ae5:604b:605a:732d:3322:5c15","TCP","1294","[TCP Retransmission] 443  >  23263 [ACK] Seq=2583 Ack=160 Win=280 Len=1220"
"184","5.329246","2a00:1450:4002:406::2001","2001:b07:ae5:604b:605a:732d:3322:5c15","TCP","1294","[TCP Retransmission] 443  >  23263 [PSH, ACK] Seq=3803 Ack=160 Win=280 Len=1220"
"185","5.329336","2001:b07:ae5:604b:605a:732d:3322:5c15","2a00:1450:4002:406::2001","TCP","74","23263  >  443 [ACK] Seq=195 Ack=6240 Win=514 Len=0"
"186","5.329440","2a00:1450:4002:405::200e","2001:b07:ae5:604b:605a:732d:3322:5c15","TCP","86","443  >  23317 [SYN, ACK] Seq=0 Ack=1 Win=65535 Len=0 MSS=1220 SACK_PERM WS=256"
"187","5.329610","2001:b07:ae5:604b:605a:732d:3322:5c15","2a00:1450:4002:406::2001","TLSv1.2","113","Application Data"
"188","5.329612","2001:b07:ae5:604b:605a:732d:3322:5c15","2a00:1450:4002:405::200e","TCP","74","23317  >  443 [ACK] Seq=1 Ack=1 Win=131584 Len=0"
"189","5.331449","2001:b07:ae5:604b:605a:732d:3322:5c15","2a00:1450:4002:405::200e","TLSv1.3","591","Client Hello"
"190","5.334829","2a00:1450:4002:402::200e","2001:b07:ae5:604b:605a:732d:3322:5c15","TLSv1.2","309","Application Data"
"191","5.334829","2a00:1450:4002:402::200e","2001:b07:ae5:604b:605a:732d:3322:5c15","TLSv1.2","147","Application Data"
"192","5.334876","2001:b07:ae5:604b:605a:732d:3322:5c15","2a00:1450:4002:402::200e","TCP","74","23248  >  443 [ACK] Seq=14209 Ack=1901 Win=2054 Len=0"
"193","5.335524","2a00:1450:4002:402::200e","2001:b07:ae5:604b:605a:732d:3322:5c15","TLSv1.2","105","Application Data"
"194","5.335568","2a00:1450:4002:402::200e","2001:b07:ae5:604b:605a:732d:3322:5c15","TLSv1.2","113","Application Data"
"195","5.335593","2001:b07:ae5:604b:605a:732d:3322:5c15","2a00:1450:4002:402::200e","TCP","74","23248  >  443 [ACK] Seq=14209 Ack=1971 Win=2058 Len=0"
"196","5.335835","2001:b07:ae5:604b:605a:732d:3322:5c15","2a00:1450:4002:402::200e","TLSv1.2","113","Application Data"
"197","5.336081","142.250.184.98","192.168.1.64","QUIC","1292","Protected Payload (KP0)"
"198","5.336081","142.250.184.98","192.168.1.64","QUIC","825","Protected Payload (KP0)"
"199","5.336081","142.250.184.98","192.168.1.64","QUIC","139","Protected Payload (KP0)"
"200","5.336081","142.250.184.98","192.168.1.64","QUIC","67","Protected Payload (KP0)"
"201","5.336400","192.168.1.64","142.250.184.98","QUIC","120","Handshake, DCID=ceb04ff2bca3bdef"
"202","5.336467","192.168.1.64","142.250.184.98","QUIC","75","Protected Payload (KP0), DCID=ceb04ff2bca3bdef"
"203","5.347592","2a00:1450:4002:406::2001","2001:b07:ae5:604b:605a:732d:3322:5c15","TCP","216","[TCP Spurious Retransmission] 443  >  23263 [PSH, ACK] Seq=1 Ack=160 Win=280 Len=142"
"204","5.347903","2001:b07:ae5:604b:605a:732d:3322:5c15","2a00:1450:4002:406::2001","TCP","86","[TCP Dup ACK 185#1] 23263  >  443 [ACK] Seq=234 Ack=6240 Win=514 Len=0 SLE=1 SRE=143"
"205","5.348436","2a00:1450:4002:406::2001","2001:b07:ae5:604b:605a:732d:3322:5c15","TCP","1294","[TCP Spurious Retransmission] 443  >  23263 [PSH, ACK] Seq=143 Ack=160 Win=280 Len=1220"
"206","5.348436","2a00:1450:4002:405::200e","2001:b07:ae5:604b:605a:732d:3322:5c15","TCP","74","443  >  23317 [ACK] Seq=1 Ack=518 Win=66816 Len=0"
"207","5.348436","2a00:1450:4002:406::2001","2001:b07:ae5:604b:605a:732d:3322:5c15","TCP","1294","[TCP Spurious Retransmission] 443  >  23263 [PSH, ACK] Seq=1363 Ack=160 Win=280 Len=1220"
"208","5.348436","2a00:1450:4002:406::2001","2001:b07:ae5:604b:605a:732d:3322:5c15","TCP","1294","[TCP Spurious Retransmission] 443  >  23263 [ACK] Seq=2583 Ack=160 Win=280 Len=1220"
"209","5.348492","2001:b07:ae5:604b:605a:732d:3322:5c15","2a00:1450:4002:406::2001","TCP","86","[TCP Dup ACK 185#2] 23263  >  443 [ACK] Seq=234 Ack=6240 Win=514 Len=0 SLE=143 SRE=1363"
"210","5.348585","2001:b07:ae5:604b:605a:732d:3322:5c15","2a00:1450:4002:406::2001","TCP","86","[TCP Dup ACK 185#3] 23263  >  443 [ACK] Seq=234 Ack=6240 Win=514 Len=0 SLE=1363 SRE=3803"
"211","5.348720","2a00:1450:4002:406::2001","2001:b07:ae5:604b:605a:732d:3322:5c15","TCP","1294","[TCP Spurious Retransmission] 443  >  23263 [PSH, ACK] Seq=3803 Ack=160 Win=280 Len=1220"
"212","5.348720","2a00:1450:4002:406::2001","2001:b07:ae5:604b:605a:732d:3322:5c15","TCP","74","443  >  23263 [ACK] Seq=6240 Ack=234 Win=280 Len=0"
"213","5.348739","2001:b07:ae5:604b:605a:732d:3322:5c15","2a00:1450:4002:406::2001","TCP","86","[TCP Dup ACK 185#4] 23263  >  443 [ACK] Seq=234 Ack=6240 Win=514 Len=0 SLE=3803 SRE=5023"
"214","5.350884","2001:b07:ae5:604b:605a:732d:3322:5c15","2a00:1450:4002:402::200e","TLSv1.2","451","Application Data"
"215","5.350968","2001:b07:ae5:604b:605a:732d:3322:5c15","2a00:1450:4002:402::200e","TLSv1.2","2576","Application Data"
"216","5.357114","142.250.184.98","192.168.1.64","QUIC","162","Protected Payload (KP0)"
"217","5.357114","142.250.184.98","192.168.1.64","QUIC","67","Protected Payload (KP0)"
"218","5.357114","142.250.184.98","192.168.1.64","QUIC","433","Protected Payload (KP0)"
"219","5.357327","192.168.1.64","142.250.184.98","QUIC","75","Protected Payload (KP0), DCID=ceb04ff2bca3bdef"
"220","5.357452","192.168.1.64","142.250.184.98","QUIC","77","Protected Payload (KP0), DCID=ceb04ff2bca3bdef"
"221","5.359841","2a00:1450:4002:402::200e","2001:b07:ae5:604b:605a:732d:3322:5c15","TCP","74","443  >  23248 [ACK] Seq=1971 Ack=14248 Win=1962 Len=0"
"222","5.362956","2a00:1450:4002:405::200e","2001:b07:ae5:604b:605a:732d:3322:5c15","TLSv1.3","1294","Server Hello, Change Cipher Spec"
"223","5.364788","2a00:1450:4002:405::200e","2001:b07:ae5:604b:605a:732d:3322:5c15","TCP","1294","443  >  23317 [PSH, ACK] Seq=1221 Ack=518 Win=66816 Len=1220 [TCP segment of a reassembled PDU]"
"224","5.364788","2a00:1450:4002:405::200e","2001:b07:ae5:604b:605a:732d:3322:5c15","TCP","1294","443  >  23317 [ACK] Seq=2441 Ack=518 Win=66816 Len=1220 [TCP segment of a reassembled PDU]"
"225","5.364821","2001:b07:ae5:604b:605a:732d:3322:5c15","2a00:1450:4002:405::200e","TCP","74","23317  >  443 [ACK] Seq=518 Ack=3661 Win=131584 Len=0"
"226","5.365451","2a00:1450:4002:405::200e","2001:b07:ae5:604b:605a:732d:3322:5c15","TCP","1294","443  >  23317 [PSH, ACK] Seq=3661 Ack=518 Win=66816 Len=1220 [TCP segment of a reassembled PDU]"
"227","5.365451","2a00:1450:4002:405::200e","2001:b07:ae5:604b:605a:732d:3322:5c15","TCP","1294","443  >  23317 [ACK] Seq=4881 Ack=518 Win=66816 Len=1220 [TCP segment of a reassembled PDU]"
"228","5.365451","2a00:1450:4002:405::200e","2001:b07:ae5:604b:605a:732d:3322:5c15","TLSv1.3","779","Application Data"
"229","5.365477","2001:b07:ae5:604b:605a:732d:3322:5c15","2a00:1450:4002:405::200e","TCP","74","23317  >  443 [ACK] Seq=518 Ack=6806 Win=131584 Len=0"
"230","5.365986","142.251.209.34","192.168.1.64","QUIC","125","Protected Payload (KP0)"
"231","5.366204","192.168.1.64","142.251.209.34","QUIC","77","Protected Payload (KP0), DCID=6e20d06ead03931a"
"232","5.367432","142.251.209.34","192.168.1.64","QUIC","67","Protected Payload (KP0)"
"233","5.368822","2a00:1450:4002:402::200e","2001:b07:ae5:604b:605a:732d:3322:5c15","TCP","74","443  >  23248 [ACK] Seq=1971 Ack=14625 Win=1971 Len=0"
"234","5.369637","2a00:1450:4002:402::200e","2001:b07:ae5:604b:605a:732d:3322:5c15","TCP","74","443  >  23248 [ACK] Seq=1971 Ack=15845 Win=1981 Len=0"
"235","5.369881","142.251.209.34","192.168.1.64","QUIC","125","Protected Payload (KP0)"
"236","5.370051","192.168.1.64","142.251.209.34","QUIC","77","Protected Payload (KP0), DCID=6e20d06ead03931a"
"237","5.370524","2a00:1450:4002:402::200e","2001:b07:ae5:604b:605a:732d:3322:5c15","TCP","74","443  >  23248 [ACK] Seq=1971 Ack=17065 Win=1990 Len=0"
"238","5.370681","2a00:1450:4002:402::200e","2001:b07:ae5:604b:605a:732d:3322:5c15","TCP","74","443  >  23248 [ACK] Seq=1971 Ack=17127 Win=1990 Len=0"
"239","5.370772","142.251.209.34","192.168.1.64","QUIC","67","Protected Payload (KP0)"
"240","5.373094","2001:b07:ae5:604b:605a:732d:3322:5c15","2a00:1450:4002:405::200e","TLSv1.3","148","Change Cipher Spec, Application Data"
"241","5.373225","2001:b07:ae5:604b:605a:732d:3322:5c15","2a00:1450:4002:405::200e","TLSv1.3","172","Application Data"
"242","5.373322","2001:b07:ae5:604b:605a:732d:3322:5c15","2a00:1450:4002:405::200e","TLSv1.3","847","Application Data"
"243","5.377957","142.250.184.98","192.168.1.64","QUIC","67","Protected Payload (KP0)"
"244","5.387569","142.251.209.34","192.168.1.64","QUIC","67","Protected Payload (KP0)"
"245","5.387958","2a00:1450:4002:405::200e","2001:b07:ae5:604b:605a:732d:3322:5c15","TLSv1.3","920","Application Data, Application Data"
"246","5.388151","2a00:1450:4002:405::200e","2001:b07:ae5:604b:605a:732d:3322:5c15","TLSv1.3","105","Application Data"
"247","5.388238","2001:b07:ae5:604b:605a:732d:3322:5c15","2a00:1450:4002:405::200e","TCP","74","23317  >  443 [ACK] Seq=1463 Ack=7683 Win=130816 Len=0"
"248","5.388398","2001:b07:ae5:604b:605a:732d:3322:5c15","2a00:1450:4002:405::200e","TLSv1.3","105","Application Data"
"249","5.392206","2a00:1450:4002:405::200e","2001:b07:ae5:604b:605a:732d:3322:5c15","TLSv1.3","432","Application Data"
"250","5.392206","2a00:1450:4002:405::200e","2001:b07:ae5:604b:605a:732d:3322:5c15","TLSv1.3","1202","Application Data"
"251","5.392324","2001:b07:ae5:604b:605a:732d:3322:5c15","2a00:1450:4002:405::200e","TCP","74","23317  >  443 [ACK] Seq=1494 Ack=9169 Win=131584 Len=0"
"252","5.392920","2a00:1450:4002:405::200e","2001:b07:ae5:604b:605a:732d:3322:5c15","TLSv1.3","113","Application Data"
"253","5.393353","2001:b07:ae5:604b:605a:732d:3322:5c15","2a00:1450:4002:405::200e","TLSv1.3","113","Application Data"
"254","5.396386","192.168.1.64","142.251.209.34","QUIC","75","Protected Payload (KP0), DCID=6e20d06ead03931a"
"255","5.410452","2a00:1450:4002:405::200e","2001:b07:ae5:604b:605a:732d:3322:5c15","TCP","74","443  >  23317 [ACK] Seq=9208 Ack=1494 Win=68352 Len=0"
"256","5.417582","2a00:1450:4002:405::200e","2001:b07:ae5:604b:605a:732d:3322:5c15","TCP","74","443  >  23317 [ACK] Seq=9208 Ack=1533 Win=68352 Len=0"
"257","5.429033","2a00:1450:4002:402::200e","2001:b07:ae5:604b:605a:732d:3322:5c15","TLSv1.2","336","Application Data"
"258","5.429280","2a00:1450:4002:402::200e","2001:b07:ae5:604b:605a:732d:3322:5c15","TLSv1.2","1271","Application Data"
"259","5.429280","2a00:1450:4002:402::200e","2001:b07:ae5:604b:605a:732d:3322:5c15","TLSv1.2","105","Application Data"
"260","5.429280","2a00:1450:4002:402::200e","2001:b07:ae5:604b:605a:732d:3322:5c15","TLSv1.2","113","Application Data"
"261","5.429455","2001:b07:ae5:604b:605a:732d:3322:5c15","2a00:1450:4002:402::200e","TCP","74","23248  >  443 [ACK] Seq=17127 Ack=3500 Win=2058 Len=0"
"262","5.431797","2001:b07:ae5:604b:605a:732d:3322:5c15","2a00:1450:4002:402::200e","TLSv1.2","113","Application Data"
"263","5.450587","2a00:1450:4002:402::200e","2001:b07:ae5:604b:605a:732d:3322:5c15","TCP","74","443  >  23248 [ACK] Seq=3500 Ack=17166 Win=1990 Len=0"
"264","8.191179","2001:b07:ae5:604b:605a:732d:3322:5c15","2a00:1450:4002:809::2004","QUIC","1292","Initial, DCID=6f3ae51841094cfe, PKN: 1, CRYPTO, CRYPTO, PADDING, CRYPTO, CRYPTO, PING, PADDING, CRYPTO, PING, PING, CRYPTO, PADDING, CRYPTO, PING, PADDING, PING, PING, CRYPTO, CRYPTO, PING, PING, PADDING, PING, CRYPTO, CRYPTO, PADDING"
"265","8.191751","2001:b07:ae5:604b:605a:732d:3322:5c15","2a00:1450:4002:809::2004","QUIC","139","0-RTT, DCID=6f3ae51841094cfe"
"266","8.196041","2001:b07:ae5:604b:605a:732d:3322:5c15","2a00:1450:4002:402::2003","QUIC","1292","Initial, DCID=ca9186caf73fab53, PKN: 1, CRYPTO, PADDING, CRYPTO, PADDING, CRYPTO, CRYPTO, CRYPTO, CRYPTO, PADDING, CRYPTO, PING, CRYPTO, PADDING"
"267","8.196500","2001:b07:ae5:604b:605a:732d:3322:5c15","2a00:1450:4002:402::2003","QUIC","135","0-RTT, DCID=ca9186caf73fab53"
"268","8.197767","2001:b07:ae5:604b:605a:732d:3322:5c15","2a00:1450:4002:809::2004","QUIC","1288","0-RTT, DCID=6f3ae51841094cfe"
"269","8.197869","2001:b07:ae5:604b:605a:732d:3322:5c15","2a00:1450:4002:809::2004","QUIC","1129","0-RTT, DCID=6f3ae51841094cfe"
"270","8.225768","2a00:1450:4002:809::2004","2001:b07:ae5:604b:605a:732d:3322:5c15","QUIC","1292","Protected Payload (KP0)"
"271","8.225768","2a00:1450:4002:809::2004","2001:b07:ae5:604b:605a:732d:3322:5c15","QUIC","831","Protected Payload (KP0)"
"272","8.226602","2001:b07:ae5:604b:605a:732d:3322:5c15","2a00:1450:4002:809::2004","QUIC","140","Handshake, DCID=6f3ae51841094cfe"
"273","8.226844","2001:b07:ae5:604b:605a:732d:3322:5c15","2a00:1450:4002:809::2004","QUIC","95","Protected Payload (KP0), DCID=6f3ae51841094cfe"
"274","8.227228","2001:b07:ae5:604b:605a:732d:3322:5c15","2a00:1450:4002:809::2004","QUIC","338","Protected Payload (KP0), DCID=6f3ae51841094cfe"
"275","8.227431","2a00:1450:4002:809::2004","2001:b07:ae5:604b:605a:732d:3322:5c15","QUIC","151","Protected Payload (KP0)"
"276","8.227431","2a00:1450:4002:809::2004","2001:b07:ae5:604b:605a:732d:3322:5c15","QUIC","87","Protected Payload (KP0)"
"277","8.233843","2a00:1450:4002:402::2003","2001:b07:ae5:604b:605a:732d:3322:5c15","QUIC","1292","Protected Payload (KP0)"
"278","8.233843","2a00:1450:4002:402::2003","2001:b07:ae5:604b:605a:732d:3322:5c15","QUIC","819","Protected Payload (KP0)"
"279","8.233843","2a00:1450:4002:402::2003","2001:b07:ae5:604b:605a:732d:3322:5c15","QUIC","171","Protected Payload (KP0)"
"280","8.234557","2001:b07:ae5:604b:605a:732d:3322:5c15","2a00:1450:4002:402::2003","QUIC","140","Handshake, DCID=ca9186caf73fab53"
"281","8.234742","2001:b07:ae5:604b:605a:732d:3322:5c15","2a00:1450:4002:402::2003","QUIC","95","Protected Payload (KP0), DCID=ca9186caf73fab53"
"282","8.243469","2a00:1450:4002:809::2004","2001:b07:ae5:604b:605a:732d:3322:5c15","QUIC","182","Protected Payload (KP0)"
"283","8.243469","2a00:1450:4002:809::2004","2001:b07:ae5:604b:605a:732d:3322:5c15","QUIC","87","Protected Payload (KP0)"
"284","8.243829","2001:b07:ae5:604b:605a:732d:3322:5c15","2a00:1450:4002:809::2004","QUIC","95","Protected Payload (KP0), DCID=6f3ae51841094cfe"
"285","8.246172","2a00:1450:4002:402::2003","2001:b07:ae5:604b:605a:732d:3322:5c15","QUIC","87","Protected Payload (KP0)"
"286","8.246172","2a00:1450:4002:809::2004","2001:b07:ae5:604b:605a:732d:3322:5c15","QUIC","87","Protected Payload (KP0)"
"287","8.246172","2a00:1450:4002:809::2004","2001:b07:ae5:604b:605a:732d:3322:5c15","QUIC","87","Protected Payload (KP0)"
"288","8.246684","2001:b07:ae5:604b:605a:732d:3322:5c15","2a00:1450:4002:809::2004","QUIC","95","Protected Payload (KP0), DCID=6f3ae51841094cfe"
"289","8.254115","2a00:1450:4002:402::2003","2001:b07:ae5:604b:605a:732d:3322:5c15","QUIC","182","Protected Payload (KP0)"
"290","8.254481","2001:b07:ae5:604b:605a:732d:3322:5c15","2a00:1450:4002:402::2003","QUIC","95","Protected Payload (KP0), DCID=ca9186caf73fab53"
"291","8.285767","2a00:1450:4002:809::2004","2001:b07:ae5:604b:605a:732d:3322:5c15","QUIC","319","Protected Payload (KP0)"
"292","8.285767","2a00:1450:4002:809::2004","2001:b07:ae5:604b:605a:732d:3322:5c15","QUIC","87","Protected Payload (KP0)"
"293","8.286318","2001:b07:ae5:604b:605a:732d:3322:5c15","2a00:1450:4002:809::2004","QUIC","97","Protected Payload (KP0), DCID=6f3ae51841094cfe"
"294","8.312622","2001:b07:ae5:604b:605a:732d:3322:5c15","2a00:1450:4002:809::2004","QUIC","95","Protected Payload (KP0), DCID=6f3ae51841094cfe"
"295","8.327270","2a00:1450:4002:809::2004","2001:b07:ae5:604b:605a:732d:3322:5c15","QUIC","89","Protected Payload (KP0)"
"296","8.327619","2001:b07:ae5:604b:605a:732d:3322:5c15","2a00:1450:4002:809::2004","QUIC","95","Protected Payload (KP0), DCID=6f3ae51841094cfe"
"297","8.370309","2a00:1450:4002:809::2004","2001:b07:ae5:604b:605a:732d:3322:5c15","QUIC","1288","Protected Payload (KP0)"
"298","8.370309","2a00:1450:4002:809::2004","2001:b07:ae5:604b:605a:732d:3322:5c15","QUIC","1292","Protected Payload (KP0)"
"299","8.370586","2001:b07:ae5:604b:605a:732d:3322:5c15","2a00:1450:4002:809::2004","QUIC","99","Protected Payload (KP0), DCID=6f3ae51841094cfe"
"300","8.370709","2001:b07:ae5:604b:605a:732d:3322:5c15","2a00:1450:4002:809::2004","QUIC","95","Protected Payload (KP0), DCID=6f3ae51841094cfe"
"301","8.371084","2a00:1450:4002:809::2004","2001:b07:ae5:604b:605a:732d:3322:5c15","QUIC","1292","Protected Payload (KP0)"
"302","8.371084","2a00:1450:4002:809::2004","2001:b07:ae5:604b:605a:732d:3322:5c15","QUIC","1292","Protected Payload (KP0)"
"303","8.371084","2a00:1450:4002:809::2004","2001:b07:ae5:604b:605a:732d:3322:5c15","QUIC","1292","Protected Payload (KP0)"
"304","8.371176","2001:b07:ae5:604b:605a:732d:3322:5c15","2a00:1450:4002:809::2004","QUIC","95","Protected Payload (KP0), DCID=6f3ae51841094cfe"
"305","8.371252","2001:b07:ae5:604b:605a:732d:3322:5c15","2a00:1450:4002:809::2004","QUIC","95","Protected Payload (KP0), DCID=6f3ae51841094cfe"
